{
  "name": "I'm Abdur Razzaque (Hassan)",
  "title": "Full Stack Developer | Laravel, React & Vue Specialist",
  "bio": "I build personal and open web apps with Laravel, React, Vue, and TypeScript — from accounting tools to e-commerce and learning platforms.",
  "email": "mdarh411@gmail.com",
  "links": {
    "github": "https://github.com/mdarh",
    "linkedin": "https://www.linkedin.com/in/mdarh411",
    "website": "https://mdarh.github.io",
    "whatsapp": "https://wa.me/01813678273",
    "telegram": "https://t.me/mdarh411",
    "facebook": "https://fb.me/hassan411",
    "youtube": "https://youtube.com/mdarh"
  },
  "skills": [
    {
      "name": "Laravel",
      "category": "Backend",
      "level": 90
    },
    {
      "name": "PHP",
      "category": "Backend",
      "level": 90
    },
    {
      "name": "Vue.js",
      "category": "Frontend",
      "level": 90
    },
    {
      "name": "React",
      "category": "Frontend",
      "level": 88
    },
    {
      "name": "Inertia.js",
      "category": "Frontend",
      "level": 85
    },
    {
      "name": "TypeScript",
      "category": "Frontend",
      "level": 82
    },
    {
      "name": "JavaScript",
      "category": "Frontend",
      "level": 90
    },
    {
      "name": "Tailwind CSS",
      "category": "Frontend",
      "level": 92
    },
    {
      "name": "MySQL",
      "category": "Database",
      "level": 85
    },
    {
      "name": "Blade",
      "category": "Frontend",
      "level": 85
    },
    {
      "name": "Python",
      "category": "Backend",
      "level": 75
    },
    {
      "name": "Git",
      "category": "Tools",
      "level": 85
    }
  ],
  "projects": [
    {
      "name": "bCloud Accounting",
      "description": "Cloud accounting app I built — invoicing, ledger, and finance workflows.",
      "tech": [
        "PHP",
        "Laravel",
        "MySQL",
        "Tailwind CSS"
      ],
      "repo_url": null,
      "live_url": "https://acc.bcloud.ac",
      "private": true,
      "status": "live",
      "featured": true,
      "visible": true,
      "image": "./images/default-project-thumbnail.svg"
    },
    {
      "name": "SWR eCommerce",
      "description": "Full-featured e-commerce store with catalog, cart, and order management for retail customers in Bangladesh.",
      "tech": [
        "Laravel",
        "Blade",
        "PHP",
        "MySQL"
      ],
      "repo_url": null,
      "live_url": "https://swrbd.com/",
      "private": true,
      "status": "live",
      "featured": true,
      "visible": true,
      "image": "./images/default-project-thumbnail.svg"
    },
    {
      "name": "Srabon Academy",
      "description": "Course management and learning platform (English Orjon) for online education, enrollment, and content delivery.",
      "tech": [
        "Laravel",
        "Blade",
        "PHP",
        "MySQL"
      ],
      "repo_url": null,
      "live_url": "https://englishorjon.com/",
      "private": true,
      "status": "live",
      "featured": true,
      "visible": true,
      "image": "./images/default-project-thumbnail.svg"
    },
    {
      "name": "Cloudflare DNS Generator",
      "description": "Public browser tool to generate Cloudflare DNS records — deployed as a GitHub Pages sub-site alongside this portfolio.",
      "tech": [
        "HTML",
        "JavaScript",
        "Cloudflare API"
      ],
      "repo_url": "https://github.com/MDARH/CloudflareDNSGenerator",
      "live_url": "https://mdarh.github.io/CloudflareDNSGenerator/",
      "private": false,
      "status": "live",
      "featured": true,
      "visible": true,
      "image": "./images/default-project-thumbnail.svg"
    },
    {
      "name": "EverFlow CRM",
      "description": "EverFlow CRM — my Laravel 13 + React (Inertia) CRM with SPA UX and API-driven workflows.",
      "tech": [
        "Laravel",
        "React",
        "Inertia.js",
        "TypeScript",
        "MySQL"
      ],
      "repo_url": null,
      "live_url": null,
      "private": true,
      "status": "in-progress",
      "featured": false,
      "visible": false,
      "image": "./images/default-project-thumbnail.svg"
    },
    {
      "name": "LIMS 2.0",
      "description": "Laboratory Information Management System — Laravel 13 + React (Inertia) + MySQL rebuild of my LIMS stack.",
      "tech": [
        "Laravel",
        "React",
        "Inertia.js",
        "MySQL"
      ],
      "repo_url": null,
      "live_url": "https://lims.bcloud.ac",
      "private": true,
      "status": "live",
      "featured": false,
      "visible": true,
      "image": "./images/default-project-thumbnail.svg"
    },
    {
      "name": "bCloud Developer Toolkit",
      "description": "Browser extension toolkit for bCloud developers — utilities that speed up day-to-day integration and debugging work.",
      "tech": [
        "JavaScript",
        "Browser Extension",
        "HTML"
      ],
      "repo_url": "https://github.com/MDARH/bCloud-developer-toolkit-extenstion",
      "live_url": "https://github.com/MDARH/bCloud-developer-toolkit-extenstion",
      "private": false,
      "status": "live",
      "featured": false,
      "visible": true,
      "image": "./images/default-project-thumbnail.svg"
    },
    {
      "name": "CapturedByHassan Auto Comment",
      "description": "AI-assisted auto-reply system for the CapturedByHassan Facebook Page using Meta Graph API and webhooks.",
      "tech": [
        "Python",
        "Meta Graph API",
        "Webhooks"
      ],
      "repo_url": null,
      "live_url": null,
      "private": true,
      "status": "planned",
      "featured": false,
      "visible": false,
      "image": "./images/default-project-thumbnail.svg"
    },
    {
      "name": "AK Halal Food",
      "description": "Food e-commerce app with product management, order processing, and delivery tracking.",
      "tech": [
        "Laravel",
        "MySQL",
        "aaPanel",
        "VPS",
        "Tailwind CSS"
      ],
      "repo_url": null,
      "live_url": "https://akhalalfood.com",
      "private": true,
      "status": "in-progress",
      "featured": false,
      "visible": true,
      "image": "./images/projects/akhalalfood/akfood-1.png"
    },
    {
      "name": "BoneIT",
      "description": "Technology company marketing site built with WordPress for content management.",
      "tech": [
        "WordPress",
        "PHP",
        "MySQL",
        "Custom Theme"
      ],
      "repo_url": null,
      "live_url": "https://boneit.com",
      "private": true,
      "status": "in-progress",
      "featured": false,
      "visible": true,
      "image": "./images/projects/boneit/boneit-1.png"
    },
    {
      "name": "BSCW Society",
      "description": "A comprehensive organization website built with Laravel, featuring member management and event organization.",
      "tech": [
        "Laravel",
        "Vue.js",
        "MySQL",
        "Tailwind CSS"
      ],
      "repo_url": null,
      "live_url": "https://bscwsociety.org/",
      "private": true,
      "status": "in-progress",
      "featured": false,
      "visible": true,
      "image": "./images/projects/bscwsociety/screenshot-1.png"
    },
    {
      "name": "Coral Condoms",
      "description": "Product showcase site built with WordPress.",
      "tech": [
        "WordPress",
        "PHP",
        "MySQL",
        "Custom Theme"
      ],
      "repo_url": null,
      "live_url": "https://coralcondoms-bd.com/",
      "private": true,
      "status": "live",
      "featured": true,
      "visible": true,
      "image": "./images/projects/coral-condoms/screenshot-1.png"
    },
    {
      "name": "PathShala CBS",
      "description": "An interactive book reading platform built with Laravel, providing a comprehensive reading experience.",
      "tech": [
        "Laravel",
        "Vue.js",
        "MySQL",
        "Tailwind CSS"
      ],
      "repo_url": null,
      "live_url": "https://pathshala-cbs.com",
      "private": true,
      "status": "in-progress",
      "featured": false,
      "visible": true,
      "image": "./images/projects/pathshala-cbs/Screenshot 2023-04-30 222444.png"
    },
    {
      "name": "Zippy Footware",
      "description": "A full-featured e-commerce platform built with Laravel and Vue.js, specializing in footwear products.",
      "tech": [
        "Laravel",
        "Vue.js",
        "MySQL",
        "Tailwind CSS"
      ],
      "repo_url": null,
      "live_url": "https://zippyfootware.com",
      "private": true,
      "status": "in-progress",
      "featured": false,
      "visible": true,
      "image": "./images/projects/zippyfootware/screenshot-1.png"
    },
    {
      "name": "SSC1982",
      "description": "A comprehensive organization website built with Laravel, featuring member management and event organization.",
      "tech": [
        "Laravel",
        "Vue.js",
        "MySQL",
        "Tailwind CSS"
      ],
      "repo_url": null,
      "live_url": "https://ssc1982.org/",
      "private": true,
      "status": "live",
      "featured": true,
      "visible": true,
      "image": "./images/projects/ssc1982/screenshot-1.png"
    },
    {
      "name": "Amdadiya",
      "description": "E-commerce platform specializing in hard copy book sales, similar to Rokomari.",
      "tech": [
        "WordPress",
        "PHP",
        "MySQL"
      ],
      "repo_url": null,
      "live_url": "https://amdadiya.com",
      "private": true,
      "status": "live",
      "featured": false,
      "visible": true,
      "image": "./images/projects/amdadiya/screenshot-1.png"
    },
    {
      "name": "bCloud Platform",
      "description": "Landing and hub for my bCloud software suite — product pages and app entry points.",
      "tech": [
        "Laravel",
        "Vue.js",
        "MySQL",
        "Tailwind CSS"
      ],
      "repo_url": null,
      "live_url": "https://bcloud.ac",
      "private": true,